{
  "irVersion": "0.1.0",
  "identity": {
    "uuid_v5": "64892bee-4cdc-5dcd-80ad-e27a6bd72276",
    "uuid_v7": "01a04291-b428-743f-bff0-3a14327a1c90",
    "uuid_namespace": "47f3e535-0e27-559a-9556-aa79a84f95eb",
    "canonical_name": "payment-pre-human",
    "category": "canonical-ir"
  },
  "temporal": {
    "created_at": "2026-08-27T09:34:00Z",
    "updated_at": "2026-08-27T09:34:00Z",
    "observed_at": "2026-08-27T09:34:00Z",
    "valid_from": "2026-08-27T09:34:00Z",
    "valid_to": null,
    "epoch_ms": 1787823240000,
    "time_zone": "UTC",
    "local_time_zone": "Asia/Tokyo",
    "local_rendering": "2026-08-27T18:34:00+09:00",
    "precision": "millisecond",
    "standard": "RFC 3339 profile"
  },
  "tool": {
    "id": "payments.commit",
    "class": "financial",
    "contractVersion": "0.1.0"
  },
  "phase": "pre",
  "gates": {
    "schema": true,
    "auth": true,
    "permission": true,
    "network": true,
    "version": true,
    "dependency": true,
    "privacy": true,
    "consent": true
  },
  "state": {
    "ambiguousPreviousEffect": false,
    "humanRequired": true
  },
  "utility": {
    "successProbabilityPPM": 999500,
    "successGain": 1000000,
    "failureLoss": 600000,
    "totalPenalty": 120000,
    "abstainUtility": 0
  },
  "verification": {
    "confidencePPM": null,
    "classFloorPPM": 999000,
    "damage": null,
    "lossBudget": null
  }
}
