{
  "irVersion": "0.1.0",
  "identity": {
    "uuid_v5": "8f5ad5c4-ec03-5d21-8eff-d2a188e865d7",
    "uuid_v7": "01a04291-b429-7bfa-9e75-ce4ca77a85ed",
    "uuid_namespace": "47f3e535-0e27-559a-9556-aa79a84f95eb",
    "canonical_name": "message-post-ambiguous",
    "category": "canonical-ir"
  },
  "temporal": {
    "created_at": "2026-08-27T09:34:00Z",
    "updated_at": "2026-08-27T09:34:00Z",
    "observed_at": "2026-08-27T09:34:00Z",
    "valid_from": "2026-08-27T09:34:00Z",
    "valid_to": null,
    "epoch_ms": 1787823240000,
    "time_zone": "UTC",
    "local_time_zone": "Asia/Tokyo",
    "local_rendering": "2026-08-27T18:34:00+09:00",
    "precision": "millisecond",
    "standard": "RFC 3339 profile"
  },
  "tool": {
    "id": "messaging.send",
    "class": "messaging",
    "contractVersion": "0.1.0"
  },
  "phase": "post",
  "gates": {
    "schema": true,
    "auth": true,
    "permission": true,
    "network": true,
    "version": true,
    "dependency": true,
    "privacy": true,
    "consent": true
  },
  "state": {
    "ambiguousPreviousEffect": true,
    "humanRequired": false
  },
  "utility": {
    "successProbabilityPPM": 910000,
    "successGain": 1000000,
    "failureLoss": 600000,
    "totalPenalty": 120000,
    "abstainUtility": 0
  },
  "verification": {
    "confidencePPM": 990000,
    "classFloorPPM": 980000,
    "damage": 50000,
    "lossBudget": 1000
  }
}
